{
  "week_id": "2026-W26",
  "revision": 1,
  "approved_at": "2026-06-29T01:00:00+00:00",
  "approved_by": "test-operator",
  "draft_generated_at": "2026-06-27T00:00:00+00:00",
  "teaser_hash": "fdc609afb24d11c1f0782bf5361d93c44bdccbc0e7cacdc469e714c8afbcecd5",
  "paid_body_hash": "3af1820138cedd6348c459806a74024d2826f38bb9196a15c1735cedaa3de0d9",
  "approval_version": 1
}
